{"run_id":"RUN-CANCELLED","idempotency_key":"key-cancelled","agreement_id":"AGR-NC-01","agreement_version":"1.0.0","participants":["nexo","nexo-compras"],"purpose":"integração","capability":"nexo-compras.integration","execution_status":"cancelled","validity_status":"pending","requested_at":"2026-08-02T12:00:00Z","finished_at":"2026-08-02T12:00:01Z","inputs":[{"reference_id":"input-1","digest":"sha256:input-1","schema":"input/1.0.0"}]}
