{"run_id":"RUN-SUPERSEDED","idempotency_key":"key-superseded","agreement_id":"AGR-NC-01","agreement_version":"1.0.0","participants":["nexo","nexo-compras"],"purpose":"integração","capability":"nexo-compras.integration","execution_status":"superseded","validity_status":"superseded","requested_at":"2026-08-02T12:00:00Z","finished_at":"2026-08-02T12:00:01Z","inputs":[{"reference_id":"input-1","digest":"sha256:input-1","schema":"input/1.0.0"}],"superseded_by_run_id":"RUN-NC-001","supersession_reason":"reprocessamento aceito"}
