{"run_id":"RUN-RUNNING","idempotency_key":"key-running","agreement_id":"AGR-NC-01","agreement_version":"1.0.0","participants":["nexo","nexo-compras"],"purpose":"integração","capability":"nexo-compras.integration","execution_status":"running","validity_status":"pending","requested_at":"2026-08-02T12:00:00Z","started_at":"2026-08-02T12:00:01Z","inputs":[{"reference_id":"input-1","digest":"sha256:input-1","schema":"input/1.0.0"}]}
