{"run_id":"RUN-PROPOSED","idempotency_key":"key-proposed","agreement_id":"AGR-NC-01","agreement_version":"1.0.0","participants":["nexo","nexo-compras"],"purpose":"integração","capability":"nexo-compras.integration","execution_status":"proposed","validity_status":"pending","requested_at":"2026-08-02T12:00:00Z","inputs":[{"reference_id":"input-1","digest":"sha256:input-1","schema":"input/1.0.0"}]}
