{"run_id":"RUN-NC-001","idempotency_key":"nexo-compras:request-001","agreement_id":"AGR-NC-01","agreement_version":"1.0.0","participants":["nexo","nexo-compras"],"actor":"system-test","purpose":"integrar oferta de compras ao projeto de pesquisa","capability":"nexo-compras.integration","execution_status":"completed","validity_status":"pending","requested_at":"2026-08-02T12:00:00Z","started_at":"2026-08-02T12:00:01Z","finished_at":"2026-08-02T12:00:02Z","inputs":[{"reference_id":"purchase-request-001","digest":"sha256:input-example","schema":"purchase-request/1.0.0","source_system_id":"nexo-compras"}],"outputs":[{"reference_id":"integrated-information-001","digest":"sha256:output-example","schema":"integrated-information/1.0.0"}],"evidence_refs":["EV-NC-001"]}
